Position,Const,Created,Modified,Description,Title,Original Title,URL,Title Type,IMDb Rating,Runtime (mins),Year,Genres,Num Votes,Release Date,Directors
40,tt0120855,2014-02-02,2014-02-02,"Well, here it is Disney's last film in the Renaissance. And Disney's last major success in a long time to come. This ended up being a match-up to Disney's previous successes like BATB, Aladdin, TLK, and TLM. It's beautiful animation, and heart-warming story, along with some great characters made this the right time to say Last but certainly not least. The road ended here with Disney's successful run for 11 years of great films, and wonderful memories. It won't until 2013 before Disney saw another success with their animations. With the exception of Tangled.","Tarzan","Tarzan",https://www.imdb.com/title/tt0120855/,Movie,7.3,88,1999,"Animation, Adventure, Comedy, Drama, Family, Music",258533,1999-06-18,"Chris Buck, Kevin Lima"
41,tt0120910,2014-02-02,2014-02-02,"After nearly 6 decades later, Fantasia finally gets a sequel. This film marked the end of the Renaissance because of it's failure critically, financially, and publically. And a Disney film hasn't had all three be a failure since The Black Cauldron in 1985. Although this wasn't as bad as Cauldron, it still was enough to end the renaissance.","Fantasia 2000","Fantasia 2000",https://www.imdb.com/title/tt0120910/,Movie,7.1,75,1999,"Animation, Family, Fantasy, Music",42704,2000-06-16,"James Algar, Gaëtan Brizzi, Paul Brizzi, Hendel Butoy, Francis Glebas, Eric Goldberg, Don Hahn, Pixote Hunt"
42,tt0130623,2014-02-02,2014-02-02,"This is Disney's version of Jurassic Park. Mainly, this is what it would look like without the blood, and deaths. A more gentle interpretation. But, these dinosaurs don't live in a park. This is a fictional telling of when the asteroid hit the Earth causing the dinosaurs to die.","Dinosaur","Dinosaur",https://www.imdb.com/title/tt0130623/,Movie,6.4,82,2000,"Animation, Adventure, Drama, Family, Fantasy",70068,2000-05-19,"Eric Leighton, Ralph Zondag"
43,tt0120917,2014-02-02,2014-02-02,"Disney completely threw out what they said before the 90's when the film will be less about humor. This is more like a very cocky, and less likable Aladdin. People didn't like this path they went. So when people saw this they thought this is what Disney is now, a joke. And it lead to Disney's future project to fail.","The Emperor's New Groove","The Emperor's New Groove",https://www.imdb.com/title/tt0120917/,Movie,7.4,78,2000,"Animation, Adventure, Comedy, Family, Fantasy",236891,2000-12-15,"Mark Dindal"
44,tt0230011,2014-02-02,2014-02-02,"And failed indeed. Atlantis is a beautiful animation with a lot of heart. But due to Disney's previous, people were just not as interested. This ended up being a box office bomb, and the worst performing film since Fantasia 2000, a year ago.","Atlantis: The Lost Empire","Atlantis: The Lost Empire",https://www.imdb.com/title/tt0230011/,Movie,6.9,95,2001,"Animation, Action, Adventure, Family, Fantasy, Sci-Fi",140937,2001-06-15,"Gary Trousdale, Kirk Wise"
45,tt0275847,2014-02-02,2014-02-02,"For sure by now, Disney has lost it's magic from the 90's, but that doesn't mean they still don't produce good films. Lilo and Stitch is a good film. Disney's best since Tarzan, and with aliens which is closely related to E.T. in a way except with a twist. Aliens don't necessarily come in peace.","Lilo & Stitch","Lilo & Stitch",https://www.imdb.com/title/tt0275847/,Movie,7.3,85,2002,"Animation, Adventure, Comedy, Drama, Family, Fantasy, Sci-Fi",224119,2002-06-21,"Dean DeBlois, Chris Sanders"
46,tt0133240,2014-02-02,2014-02-02,"As you can see Disney tried to bring back the 90's with this film. I just didn't work out. Another failure, and another disappointment.","Treasure Planet","Treasure Planet",https://www.imdb.com/title/tt0133240/,Movie,7.2,95,2002,"Animation, Adventure, Family, Fantasy, Sci-Fi",140536,2002-11-29,"Ron Clements, John Musker"
47,tt0280030,2014-02-02,2014-02-02,"Peter Pan's sequel, and a theatrical release. Was it good? You be the judge of that.","Return to Never Land","Return to Never Land",https://www.imdb.com/title/tt0280030/,Movie,5.8,72,2002,"Animation, Adventure, Family, Fantasy",22994,2002-02-15,"Robin Budd, Donovan Cook"
48,tt0328880,2014-02-02,2014-02-02,"My personal favorite of the 2000's. Brother Bear brought back great songs by Phil Collins, again. And really felt they had something with this. But Disney in the 2000's was not the same. People stopped going to the theatre to watch these. At least not as much as they use to.","Brother Bear","Brother Bear",https://www.imdb.com/title/tt0328880/,Movie,6.9,85,2003,"Animation, Adventure, Comedy, Drama, Family, Fantasy, Musical",130062,2003-11-01,"Aaron Blaise, Robert Walker"
49,tt0283426,2018-06-28,2018-06-28,"Obviously nowhere near as good as the original, Disney tried their hands at another sequel, and again it falls flat. Just a cheap attempt at cashing in on nostalgia. Better next time. ","The Jungle Book 2","The Jungle Book 2",https://www.imdb.com/title/tt0283426/,Movie,5.3,72,2003,"Animation, Adventure, Comedy, Family, Music, Musical",18770,2003-02-14,"Steve Trenbirth"
50,tt0361089,2016-02-19,2016-02-19,"Eww! That's all I got to say.","Valiant","Valiant",https://www.imdb.com/title/tt0361089/,Movie,5.5,76,2005,"Animation, Adventure, Comedy, Family, War",25129,2005-08-19,"Gary Chapman"
51,tt0299172,2014-02-02,2014-02-02,"After this Disney said You know what we're done, these animations are not working anymore, so we are going to stop hand-drawn animations. As a result they switched to the now popular computer animation. Disney didn't make another hand-drawn animation until 2009. 5 years later.","Home on the Range","Home on the Range",https://www.imdb.com/title/tt0299172/,Movie,5.4,76,2004,"Animation, Adventure, Comedy, Family, Musical, Western",27617,2004-04-02,"Will Finn, John Sanford"
52,tt0371606,2014-02-02,2014-02-02,"Walt Disney's very first computer animated feature, not counting Pixar. However, even this was unsuccessful. It is now considered as the worst Disney animation to date. The dumb humor, with dull characters, and no memorable songs made this the Jack and Jill of Disney movies.","Chicken Little","Chicken Little",https://www.imdb.com/title/tt0371606/,Movie,5.7,81,2005,"Animation, Adventure, Comedy, Family, Fantasy, Sci-Fi",104795,2005-11-04,"Mark Dindal"
53,tt0405469,2014-02-02,2014-02-02,"Disney's version of Madagascar. Some critics actually say that this is better then Madagascar, as a film with better animation, and other things.","The Wild","The Wild",https://www.imdb.com/title/tt0405469/,Movie,5.2,82,2006,"Animation, Adventure, Comedy, Family",28644,2006-04-14,"Steve 'Spaz' Williams"
54,tt0396555,2014-02-02,2014-02-02,"Based off of the Swiss Family Robinson, this film is a fun and humorous one. A light at the end of Disney's tunnel of unsuccessful films in the 2000's, they are now heading in the right direction once again. It's like a rollercoaster for Disney, in the 30's they were successful, 40's not so much. 50's were ok, 60's good, 70's not so good. 80's mediocre, 90's outstanding, 00's worse then the 70's, and 2010's coming back.","Meet the Robinsons","Meet the Robinsons",https://www.imdb.com/title/tt0396555/,Movie,6.8,95,2007,"Animation, Adventure, Comedy, Family, Musical, Sci-Fi",116483,2007-03-30,"Stephen J. Anderson"
55,tt1050739,2016-02-19,2016-02-19,,"Roadside Romeo","Roadside Romeo",https://www.imdb.com/title/tt1050739/,Movie,4.9,93,2008,"Animation, Adventure, Comedy, Family, Fantasy, Music, Musical, Romance",1793,2008-10-24,"Jugal Hansraj"
56,tt0397892,2014-02-02,2014-02-02,"Disney's next great film in my opinion. The best since Tarzan. Featuring your typical dog, cat, and hamster trio. Wait...is that normal? Disney is coming to life once again.","Bolt","Bolt",https://www.imdb.com/title/tt0397892/,Movie,6.8,96,2008,"Animation, Adventure, Comedy, Crime, Drama, Family, Sci-Fi",238376,2008-11-21,"Byron Howard, Chris Williams"
57,tt1067106,2016-02-19,2016-02-19,,"A Christmas Carol","A Christmas Carol",https://www.imdb.com/title/tt1067106/,Movie,6.8,96,2009,"Animation, Adventure, Comedy, Drama, Family, Fantasy",135502,2009-11-06,"Robert Zemeckis"
58,tt0780521,2014-02-02,2014-02-02,"Back to Disney's traditional hand-drawn animation. The Princess and the Frog showed that Disney still has got it. It ended up being a lost film of the renaissance as it was as successful as Aladdin in the box office. I love it when Disney returns to the roots, when Disney was awesome.","The Princess and the Frog","The Princess and the Frog",https://www.imdb.com/title/tt0780521/,Movie,7.2,97,2009,"Animation, Adventure, Comedy, Family, Fantasy, Musical, Romance",177118,2009-12-11,"Ron Clements, John Musker"
59,tt0398286,2014-02-02,2014-02-02,"To some people the years of 2009-2013 is considered the Disney Revival. Another time with a series of successful films by Disney. And Tangled proves that Disney never lost it's magic at all. They were just sick with a 104 degree fever for a decade. But now they are back, and just as good as the 90's.","Tangled","Tangled",https://www.imdb.com/title/tt0398286/,Movie,7.7,100,2010,"Animation, Adventure, Comedy, Family, Fantasy, Musical, Romance",519350,2010-11-24,"Nathan Greno, Byron Howard"
60,tt1305591,2014-02-02,2014-02-02,"In the 90's renaissance you had DuckTale, the movie that was not as good as the others. Mars Needs Moms is like that. A very unsuccessful film that was a box office bomb. Disney lost a lot of money as the box office total didn't come close to it's budget.","Mars Needs Moms","Mars Needs Moms",https://www.imdb.com/title/tt1305591/,Movie,5.4,88,2011,"Animation, Adventure, Family, Fantasy, Sci-Fi",24631,2011-03-11,"Simon Wells"
61,tt1449283,2014-02-02,2014-02-02,"Disney most recent hand-drawn animation with Winnie the Pooh. I hope Disney makes more as they can still make successful hand-drawn animations.","Winnie the Pooh","Winnie the Pooh",https://www.imdb.com/title/tt1449283/,Movie,7.1,63,2011,"Animation, Adventure, Comedy, Family, Fantasy, Musical",29482,2011-08-29,"Stephen J. Anderson, Don Hall"
62,tt2404027,2016-02-19,2016-02-19,,"Arjun: The Warrior Prince","Arjun: The Warrior Prince",https://www.imdb.com/title/tt2404027/,Movie,6.8,96,2012,"Animation, Action, Adventure",2177,2012-05-25,"Arnab Chaudhuri, Pavan Buragohain, K.K. Raina"
63,tt1142977,2014-02-02,2014-02-02,"Tim Burton teams up with Disney to make a version of Frankenstein with a dog. Good enough to earn an Oscar nom.","Frankenweenie","Frankenweenie",https://www.imdb.com/title/tt1142977/,Movie,6.9,87,2012,"Animation, Comedy, Drama, Family, Horror, Sci-Fi, Thriller",121869,2012-10-05,"Tim Burton"
64,tt1772341,2014-02-02,2014-02-02,"This was a shocker to me. I didn't think this was going to be good, but Disney once again proved me wrong.","Wreck-It Ralph","Wreck-It Ralph",https://www.imdb.com/title/tt1772341/,Movie,7.7,101,2012,"Animation, Adventure, Comedy, Family, Fantasy, Sci-Fi, Sport",478492,2012-11-02,"Rich Moore"
65,tt2294629,2014-02-02,2014-12-15,"This film has a lot of back and forth, some people say it is as good as Lion King, while other say it isn't anywhere close. Well, it beat Lion King at the box office becoming the highest grossing animated film of all time, garnishing over a billion dollars. The first Disney animation to ever reach the billion dollar mark. A true milestone in the history of Disney Animation, and this should keep them coming for years to come. I think the animation's future is well at hand.","Frozen","Frozen",https://www.imdb.com/title/tt2294629/,Movie,7.4,102,2013,"Animation, Adventure, Comedy, Family, Fantasy, Musical",687075,2013-11-27,"Chris Buck, Jennifer Lee"
66,tt2245084,2014-09-29,2015-04-14,"Disney keeps rolling along, seems like they got things under control for the moment. Even though this didn't get a billion in the box office it did real well critically and publically, and that's all that should matter. This also stole the Oscar for Best Animation in 2015.","Big Hero 6","Big Hero 6",https://www.imdb.com/title/tt2245084/,Movie,7.8,102,2014,"Animation, Action, Adventure, Comedy, Crime, Family, Sci-Fi",527665,2014-11-07,"Don Hall, Chris Williams"
67,tt2948356,2016-02-19,2016-02-19,"The next film to feature all animals, the last one to do that was The Lion King in 1994. This film marks the 65 film released in Disney history. Man, this company has come a long way, the same company that made Snow White back in 1937, now released Zootopia in 2016. WOW!!!!","Zootopia","Zootopia",https://www.imdb.com/title/tt2948356/,Movie,8.0,108,2016,"Animation, Action, Adventure, Comedy, Crime, Family, Mystery",577719,2016-03-04,"Byron Howard, Rich Moore, Jared Bush"
68,tt3521164,2017-01-21,2017-01-21,"A new kind of story by Disney. But, like recently they manage to execute brilliantly. Seriously, it seems like everything Disney touches nowadays turns into gold. Is it safe to say that Disney's back? Yes, it is, they've been for a while now. Since, Bolt. Moana is another classic animated film with the returning directors of John Musker and Ron Clements, the geniuses behind Aladdin, and The Princess and the Frog.","Moana","Moana",https://www.imdb.com/title/tt3521164/,Movie,7.6,107,2016,"Animation, Adventure, Comedy, Family, Fantasy, Musical",413674,2016-11-23,"Ron Clements, John Musker, Don Hall, Chris Williams"
69,tt5848272,2020-11-28,2020-11-28,"A film that finally proved Disney can make a good sequel, not just creatively, but financial as well. With the heartwarming and charming relationship between Ralph and Vanellope, and possibly the funniest moments in recent animated films serves at perhaps Disney’s best sequel as well. ","Ralph Breaks the Internet","Ralph Breaks the Internet",https://www.imdb.com/title/tt5848272/,Movie,7.0,112,2018,"Animation, Adventure, Comedy, Family, Fantasy, Sci-Fi, Sport",194376,2018-11-21,"Phil Johnston, Rich Moore"
70,tt4520988,2020-11-28,2020-11-28,"This is the first time in Disney history that they’ve ever released two sequels back-to-back in theaters. This is a follow-up to Disney’s most successful animated film to date...until now. Frozen has been dethroned by its own sequel as the highest grossing animated film of all time. The film itself however is a downgrade from the original in my personal opinion. ","Frozen II","Frozen II",https://www.imdb.com/title/tt4520988/,Movie,6.8,103,2019,"Animation, Adventure, Comedy, Drama, Family, Fantasy, Musical",206847,2019-11-22,"Chris Buck, Jennifer Lee"
71,tt5109280,2020-11-28,2020-11-28,"Upcoming ","Raya and the Last Dragon","Raya and the Last Dragon",https://www.imdb.com/title/tt5109280/,Movie,7.3,107,2021,"Animation, Action, Adventure, Comedy, Drama, Family, Fantasy",180325,2021-03-05,"Don Hall, Carlos López Estrada, Paul Briggs, John Ripa"
72,tt2953050,2020-11-28,2020-11-28,"Upcoming ","Encanto","Encanto",https://www.imdb.com/title/tt2953050/,Movie,7.2,102,2021,"Animation, Comedy, Family, Fantasy, Musical",280776,2021-11-24,"Jared Bush, Byron Howard, Charise Castro Smith"
